{
    "$schema": "https://json-schema.org/draft/2020-12/schema",
    "$id": "https://nationalarchives.gov.uk/da-transform/tre/schemas/tre-event",
    "type": "object",
    "properties": {
        "version": {
            "type": "string"
        },
        "timestamp": {
            "type": "integer"
        },
        "UUIDs": {
            "type": "array",
            "minItems": 1,
            "items": {
                "type": "object",
                "patternProperties": {
                    "^[a-zA-Z0-9_-]+-UUID$": {
                        "type": "string",
                        "pattern": "^[0-9a-f]{8}-[0-9a-f]{4}-[0-9a-f]{4}-[0-9a-f]{4}-[0-9a-f]{12}$"
                    }
                },
                "additionalProperties": false
            },
            "additionalProperties": false
        },
        "producer": {
            "type": "object",
            "properties": {
                "name": {
                    "type": "string"
                },
                "process": {
                    "type": ["string", "null"]
                },
                "type": {
                    "type": [
                        "string",
                        "null"
                    ],
                    "enum": [
                        "judgment",
                        "standard",
                        null
                    ]
                },
                "environment": {
                    "type": ["string", "null"]
                },
                "event-name": {
                    "type": "string",
                    "pattern": "^[.a-zA-Z0-9_-]+$"
                },
                "version": {
                    "type": ["string", "object"]
                }
            },
            "required": [
                "name",
                "process",
                "type",
                "environment",
                "event-name"
            ],
            "additionalProperties": false
        },
        "parameters": {
            "type": "object"
        }
    },
    "required": [
        "version",
        "timestamp",
        "UUIDs",
        "producer",
        "parameters"
    ],
    "additionalProperties": false
}