{
  "version": "1.0.0",
  "timestamp": 1661340417609575000,
  "UUIDs": [
    {
      "TDR-UUID": "c73e5ca7-cf87-442a-8248-e05f81361ae0"
    },
    {
      "TRE-UUID": "ec506d7f-f531-4e63-833e-841918105e41"
    },
    {
      "TRE-UUID": "3c1db304-090f-4b19-abfc-8618cc0e5875"
    }
  ],
  "producer": {
    "environment": "dev",
    "name": "TRE",
    "process": "dev-tre-validate-bagit",
    "event-name": "bagit-validated",
    "type": "standard"
  },
  "parameters": {
    "bagit-validated": {
      "reference": "ABC-1234-DEF",
      "s3-bucket": "dev-tre-common-data",
      "s3-bagit-name": "consignments/standard/ABC-1234-DEF/c73e5ca7-cf87-442a-8248-e05f81361ae0/ABC-1234-DEF.tar.gz",
      "s3-object-root": "consignments/standard/ABC-1234-DEF/c73e5ca7-cf87-442a-8248-e05f81361ae0/ABC-1234-DEF",
      "validated-files": {
        "path": "consignments/standard/ABC-1234-DEF/c73e5ca7-cf87-442a-8248-e05f81361ae0/ABC-1234-DEF",
        "root": [
          "consignments/standard/ABC-1234-DEF/c73e5ca7-cf87-442a-8248-e05f81361ae0/ABC-1234-DEF/bagit.txt",
          "consignments/standard/ABC-1234-DEF/0/ABC-1234-DEF/manifest-sha256.txt"
        ],
        "data": [
          "consignments/standard/ABC-1234-DEF/c73e5ca7-cf87-442a-8248-e05f81361ae0/ABC-1234-DEF/data/content/foo.docx",
          "consignments/standard/ABC-1234-DEF/c73e5ca7-cf87-442a-8248-e05f81361ae0/ABC-1234-DEF/data/content/bar.png"
        ]
      }
    }
  }
}
